id;name;category;duration_min;difficulty;physical_intensity;requires_morning;requires_silence;max_completions_per_day;habit_min_streak_days;habit_min_score;steps;contraindications;benefits;tags
155;Осознанная пауза на 3 дыхания;yoga;8;1;low;false;false;3;21;70;Остановись на месте где бы ты ни был | Сделай 3 медленных осознанных дыхания | Замечай вдох, выдох и ощущения в теле | На третьем выдохе задай намерение следующего действия | Продолжай день;none;Создаёт паузу между стимулом и реакцией, возвращает в настоящий момент, снижает реактивность, развивает осознанность в течение дня.;breath,mindfulness,pause,awareness,daily_practice
156;Симхасана с львиным дыханием;yoga;10;2;low;false;false;1;21;70;Сядь на пятки или в удобную позу | Вдохни через нос | На выдохе высунь язык, широко открой глаза и рот, издай звук «ха» | Повтори 3-5 раз | Расслабь лицо;none;Снимает напряжение с лица и челюсти, освобождает горло, выпускает эмоции, улучшает настроение, забавная практика.;breath,release,face,playful,tension_relief
157;Осознанное дыхание (сидя);meditation;1;1;low;false;true;1;21;70;Сядь удобно с прямой но мягкой спиной | Закрой глаза | Наблюдай дыхание, не меняя его | Когда ум уходит, мягко возвращайся к дыханию | Без самокритики | Продолжай 1-20 минут;none;Основа медитации осознанности, развивает концентрацию, успокаивает ум, учит наблюдать без оценки, доступна всем.;meditation,breath,mindfulness,beginner,foundational
158;Медитация на дыхании 10 минут;meditation;5;1;low;false;true;1;14;70;Сядь удобно с прямой спиной | Закрой глаза | Наблюдай дыхание в ноздрях или животе | Когда отвлекаешься, мягко возвращайся | Продолжай 10 минут | Медленно открой глаза;none;Развивает устойчивую концентрацию, успокаивает ум, снижает стресс, улучшает осознанность, основа регулярной практики.;meditation,breath,focus,calmness,daily_practice
159;Body Scan (сканирование тела);meditation;7;1;low;false;true;1;14;70;Ляг или сядь удобно | Закрой глаза | Медленно проведи вниманием от стоп к макушке | По 1-2 дыхания на каждую зону | Замечай ощущения без попыток их изменить | Тепло, напряжение, контакт с опорой;none;Развивает осознанность тела, снимает напряжение, успокаивает ум, помогает заснуть, учит принятию ощущений.;meditation,body,awareness,relaxation,sleep
160;Body Scan перед сном;meditation;8;1;low;false;true;1;14;70;Ляг в постели | Закрой глаза | Медленно сканируй тело от стоп к макушке | Расслабляй каждую часть тела | Если заснёшь в процессе — это нормально | Отпускай день с каждым выдохом;none;Готовит ко сну, глубоко расслабляет тело, успокаивает ум, помогает при бессоннице, отпускает дневное напряжение.;meditation,body,sleep,relaxation,evening
161;Медитация звуков;meditation;10;1;low;false;true;1;14;70;Сядь удобно | Закрой глаза | Слушай все звуки вокруг без оценки: близкие, дальние, громкие, тихие | Замечай паузы и тишину между звуками | Возвращайся к слушанию при отвлечении | 10-20 минут;none;Развивает осознанность слуха, успокаивает ум, учит принятию без оценки, расширяет восприятие, подходит для городских условий.;meditation,sound,awareness,acceptance,mindfulness
162;Открытое осознавание;meditation;12;3;low;false;true;1;14;70;Сядь удобно | Начни с наблюдения дыхания | Постепенно расширяй осознанность на все ощущения | Звуки, мысли, эмоции, телесные ощущения | Наблюдай всё что возникает без фокуса на чём-то одном | 10-20 минут;none;Развивает широкое осознавание, учит быть с любым опытом, углубляет медитацию, требует практики концентрации.;meditation,awareness,advanced,openness,presence
163;Медитация мыслей как событий;meditation;15;2;low;false;true;1;14;70;Сядь удобно | Наблюдай мысли как облака на небе | Замечай когда мысль появляется, остаётся, уходит | Не вовлекайся в содержание | Возвращайся к наблюдению | Мысли — просто события в уме;none;Развивает дистанцию от мыслей, снижает реактивность, учит не отождествляться с мыслями, помогает при тревоге.;meditation,thoughts,awareness,detachment,anxiety_relief
164;Медитация чувств в теле;meditation;1;2;low;false;true;1;14;70;Сядь удобно | Замечай эмоции как ощущения в теле | Где живёт грусть, радость, тревога | Наблюдай без попыток изменить | Дыши в эту область | Чувства приходят и уходят;none;Развивает осознанность эмоций, учит быть с чувствами, снижает эмоциональную реактивность, помогает при сложных состояниях.;meditation,emotions,body,awareness,acceptance
165;Медитация любящей доброты (Metta);meditation;5;2;low;false;true;1;14;70;Сядь спокойно | Начни с себя: «Пусть я буду в безопасности, здоров, спокоен, счастлив» | Затем близкий человек | Нейтральный человек | Все существа | Повторяй фразы, чувствуя пожелание;none;Развивает доброжелательность и сострадание, улучшает отношения, снижает самокритику, повышает благополучие, исцеляет сердце.;meditation,metta,compassion,kindness,healing
166;Метта для себя;meditation;7;2;low;false;true;1;14;70;Сядь спокойно | Представь себя | Повторяй: «Пусть я буду в безопасности, здоров, спокоен, счастлив» | Почувствуй искреннее пожелание себе | Если сложно, представь себя ребёнком | 5-10 минут;none;Развивает самосострадание, снижает самокритику, исцеляет отношения с собой, укрепляет внутреннюю поддержку.;meditation,metta,self_compassion,healing,kindness
167;Метта для близкого;meditation;8;2;low;false;true;1;14;70;Сядь спокойно | Представь близкого человека | Повторяй: «Пусть ты будешь в безопасности, здоров, спокоен, счастлив» | Почувствуй тепло и пожелание добра | Продолжай 5-10 минут;none;Укрепляет связь с близкими, развивает любовь и заботу, улучшает отношения, наполняет сердце теплом.;meditation,metta,relationships,love,connection
168;Метта для нейтрального человека;meditation;10;2;low;false;true;1;14;70;Сядь спокойно | Представь человека, к которому нейтрален (кассир, сосед) | Повторяй фразы доброжелательности | Помни, что он тоже хочет быть счастливым | Расширяй круг заботы;none;Расширяет круг сострадания, развивает равностность, учит видеть человечность в каждом, преодолевает безразличие.;meditation,metta,compassion,equality,expansion
169;Метта для трудного человека;meditation;12;3;low;false;true;1;14;70;Сядь спокойно | Начни с себя и близких для разогрева сердца | Затем представь слегка трудного человека (не самого сложного) | Повторяй фразы доброжелательности | Помни: он страдает, как и все | Будь мягок с собой;none;Исцеляет обиды, развивает прощение, освобождает от гнева, требует готовности и практики, глубоко трансформирует.;meditation,metta,forgiveness,healing,advanced
170;Сострадательная медитация;meditation;15;2;low;false;true;1;14;70;Сядь удобно | Представь страдающего человека или себя в трудности | Почувствуй сострадание | Повторяй: «Пусть ты освободишься от страдания» | Дыши в область сердца | Посылай тепло и поддержку;none;Развивает глубокое сострадание, исцеляет сердце, помогает быть с болью других и своей, трансформирует страдание в заботу.;meditation,compassion,healing,heart,empathy
171;RAIN для сложной эмоции;meditation;1;2;low;false;false;1;14;70;Когда чувствуешь сложную эмоцию, остановись | Recognize: назови чувство | Allow: разреши ему быть | Investigate: заметь где оно в теле, какие мысли рядом | Nurture: поддержи себя добрым словом или жестом;none;Помогает работать со сложными эмоциями, развивает самосострадание, учит быть с трудным опытом, снижает реактивность.;meditation,emotions,self_compassion,RAIN,coping
172;Медитация самосострадания;meditation;5;2;low;false;true;1;14;70;Заметь трудный момент | Скажи себе: «Мне сейчас трудно» (осознание) | «Трудности — часть человеческого опыта» (общность) | «Пусть я буду добрее к себе прямо сейчас» (доброта) | Положи руку на сердце | Дыши мягко;none;Развивает самосострадание в трудные моменты, снижает самокритику, помогает быть с болью, укрепляет внутреннюю поддержку.;meditation,self_compassion,kindness,support,healing
173;Медитация благодарности;meditation;7;1;low;false;true;1;14;70;Сядь на несколько минут | По очереди удерживай в уме 3 вещи или людей, за которые благодарен | На каждую — 2-3 дыхания | Замечай телесный отклик: тепло, расширение, мягкость | Завершай с чувством благодарности;none;Повышает благополучие, улучшает настроение, развивает позитивный фокус, укрепляет отношения, исцеляет сердце.;meditation,gratitude,wellbeing,positivity,heart
174;Медитация прощения (мягкая);meditation;8;3;low;false;true;1;14;70;Сядь удобно | Представь ситуацию, где хочешь простить (себя или другого) | Не форсируй прощение | Просто будь с болью и намерением отпустить | Повторяй: «Насколько могу, я прощаю» | Будь терпелив к процессу;none;Начинает процесс прощения, освобождает от обид, исцеляет сердце, требует времени и повторения, мягкий подход.;meditation,forgiveness,healing,release,gentle
175;Медитация на намерение дня;meditation;10;1;low;true;false;1;14;70;Утром сядь на 5-10 минут | Подумай о предстоящем дне | Задай себе вопрос: «Как я хочу прожить этот день?» | Выбери одно качество или намерение (доброта, терпение, присутствие) | Представь себя живущим с этим намерением;none;Задаёт направление дню, развивает осознанность намерений, помогает жить в соответствии с ценностями, улучшает качество дня.;meditation,intention,morning,values,direction
176;Медитация наблюдения эмоций;meditation;12;2;low;false;true;1;14;70;Сядь удобно | Наблюдай эмоции, которые возникают | Замечай их как погоду: приходят и уходят | Не вовлекайся, не отталкивай | Называй: «радость», «тревога», «скука» | Возвращайся к дыханию;none;Развивает осознанность эмоций, учит не отождествляться с чувствами, снижает эмоциональную реактивность, помогает при перепадах настроения.;meditation,emotions,awareness,equanimity,detachment
177;Пауза между стимулом и реакцией;meditation;15;2;low;false;false;3;21;70;В течение дня замечай импульс отреагировать | Сделай паузу: 1-3 дыхания | Почувствуй тело, эмоцию | Спроси: «Как я хочу ответить?» | Выбери осознанно | Практикуй регулярно;none;Развивает осознанность в действиях, снижает импульсивность, улучшает отношения, учит выбору вместо автоматизма.;meditation,mindfulness,response,choice,daily_practice
178;Медитация на дыхание и счёт;meditation;1;1;low;false;true;1;14;70;Сядь удобно | Считай дыхания: вдох-выдох = 1, следующий вдох-выдох = 2 | Считай до 10, затем начинай снова | Если сбился, начни с 1 | Без самокритики | 10-20 минут;none;Развивает концентрацию, успокаивает ум, простая техника для начинающих, помогает заметить отвлечения.;meditation,breath,counting,focus,beginner
179;Стоячая медитация;meditation;5;1;low;false;false;1;14;70;Встань устойчиво, ноги на ширине плеч | Закрой глаза или мягкий взгляд вниз | Почувствуй стопы, вес тела, дыхание | Наблюдай ощущения стояния | Возвращайся к телу при отвлечении | 5-15 минут;none;Развивает осознанность тела, альтернатива сидячей медитации, укрепляет ноги, подходит при сонливости или боли в спине.;meditation,standing,body,awareness,alternative
180;Медитация ходьбы (короткая);meditation;7;1;low;false;false;1;14;70;Иди медленнее обычного | Перенеси внимание на шаг: подъём стопы, перенос, касание | Если ум уходит в мысли, мягко вернись к ощущениям ног и дыханию | 5-10 минут | Можно дома или на улице;none;Развивает осознанность движения, альтернатива сидячей медитации, успокаивает ум, подходит для активных людей.;meditation,walking,movement,mindfulness,active
181;Медитация ходьбы (длинная);meditation;8;1;low;false;false;1;14;70;Иди медленнее обычного на природе или в парке | Перенеси внимание на шаг, дыхание, окружение | Чередуй фокус: стопы, дыхание, звуки, виды | 15-30 минут | Возвращайся к ощущениям при отвлечении;none;Развивает глубокую осознанность, соединяет с природой, успокаивает ум, подходит для длительной практики на свежем воздухе.;meditation,walking,nature,mindfulness,extended
182;Медитация осознанного питания;meditation;10;2;low;false;false;1;14;70;Возьми небольшую порцию еды (изюм, орех) | Рассмотри, понюхай, почувствуй текстуру | Медленно положи в рот, не жуя | Затем медленно прожуй, замечая вкус и ощущения | Проглоти осознанно | 5-10 минут на небольшую порцию;none;Развивает осознанность в еде, помогает с перееданием, учит замедляться, улучшает отношения с пищей, развивает благодарность.;meditation,eating,mindfulness,awareness,gratitude
183;Медитация с чашкой чая;meditation;12;1;low;false;false;1;14;70;Завари чай осознанно | Держи чашку, почувствуй тепло | Понюхай аромат | Сделай первый глоток медленно, замечая вкус | Продолжай пить осознанно | Будь полностью с процессом 10-15 минут;none;Превращает обычное действие в медитацию, развивает осознанность, учит присутствию, создаёт паузу в дне, успокаивает.;meditation,tea,mindfulness,ritual,presence
184;Медитация перед сном на дыхание;meditation;15;1;low;false;true;1;14;70;Ляг удобно в постели | Удлини выдох | Считай дыхания или наблюдай движения живота | Если приходят мысли, отмечай их как «мысль» и возвращайся к дыханию | Продолжай до засыпания;none;Готовит ко сну, успокаивает ум, помогает при бессоннице, отпускает дневные заботы, улучшает качество сна.;meditation,sleep,breath,bedtime,insomnia
185;Медитация на пространство тела;meditation;1;2;low;false;true;1;14;70;Сядь или ляг удобно | Почувствуй пространство внутри тела | Пространство в животе, груди, голове | Наблюдай как дыхание движется в этом пространстве | Расширяй осознанность пространства | 10-15 минут;none;Развивает тонкую осознанность тела, создаёт ощущение простора, успокаивает, помогает при тревоге и зажатости.;meditation,body,space,awareness,subtle
186;Медитация на звуки и тишину;meditation;5;1;low;false;true;1;14;70;Сядь удобно | Слушай все звуки без оценки | Особенно замечай паузы и тишину между звуками | Тишина — тоже звук | Возвращайся к слушанию при отвлечении | 10-20 минут;none;Развивает осознанность звука и тишины, успокаивает ум, учит замечать паузы, углубляет восприятие, подходит для любых условий.;meditation,sound,silence,awareness,depth
187;Сидеть и не исправлять;meditation;7;2;low;false;true;1;14;70;Сядь удобно | Позволь всему быть как есть | Не пытайся исправить дыхание, мысли, ощущения | Просто наблюдай | Практикуй принятие того, что есть | 10-20 минут;none;Развивает принятие, учит отпускать контроль, успокаивает ум, помогает при перфекционизме, углубляет медитацию.;meditation,acceptance,letting_go,presence,non_doing
188;Мини-медитация 1 минута;meditation;8;1;low;false;false;10;21;70;Остановись где бы ты ни был | Почувствуй стопы на полу | Сделай 3 медленных вдоха и выдоха | На последнем выдохе задай намерение на следующий шаг | Продолжай день | Повторяй несколько раз в день;none;Создаёт паузы в течение дня, возвращает в настоящий момент, снижает стресс, доступна везде, развивает регулярность практики.;meditation,mini,pause,grounding,daily_practice
189;Осознанные 3 вдоха;meditation;10;1;low;false;false;10;21;70;В любой момент дня остановись | Сделай 3 осознанных вдоха и выдоха | Замечай начало вдоха, середину, конец | То же с выдохом | Возвращайся к тому, что делал | Практикуй регулярно;none;Простейшая практика осознанности, доступна везде, снижает стресс, возвращает в момент, можно делать много раз в день.;meditation,breath,mini,simple,accessible
190;Медитация благодарности телу;meditation;12;1;low;false;true;1;14;70;Сядь или ляг удобно | Мысленно пройдись по телу | Благодари каждую часть за её работу | Сердце за биение, ноги за ходьбу, руки за действия | Почувствуй благодарность к телу | 10-15 минут;none;Улучшает отношения с телом, развивает благодарность, исцеляет критику тела, повышает самопринятие, наполняет теплом.;meditation,gratitude,body,healing,self_acceptance
191;Медитация доброжелательности к незнакомцам;meditation;15;2;low;false;true;1;14;70;Сядь спокойно | Представь незнакомых людей на улице | По очереди посылай им доброжелательность | «Пусть ты будешь счастлив» | Расширяй круг заботы на всех | 10-15 минут;none;Расширяет сострадание на всех людей, развивает связь с человечеством, преодолевает отчуждение, наполняет сердце.;meditation,metta,strangers,compassion,connection
