id;name;category;duration_min;difficulty;physical_intensity;requires_morning;requires_silence;max_completions_per_day;habit_min_streak_days;habit_min_score;steps;contraindications;benefits;tags
114;Воин II у стены;yoga;10;2;low;false;false;1;14;70;Встань спиной к стене | Выполни Воина II, опираясь крестцом на стену | Держи 5-7 дыханий | Повтори на другую сторону;knee_pain;Помогает почувствовать правильное выравнивание таза, укрепляет ноги, развивает устойчивость, подходит для изучения позы.;warrior,accessible,props,alignment,learning
115;Уткатасана у стены;yoga;2;2;low;false;false;1;14;70;Встань спиной к стене | Опустись в позу Стула, спина на стене | Держи 5-7 дыханий | Медленно поднимись;knee_pain,back_pain;Помогает почувствовать правильное выравнивание, укрепляет ноги без перегрузки спины, подходит для начинающих.;accessible,props,legs,alignment,beginner
116;Наклон стоя у стены;yoga;3;2;low;false;false;1;14;70;Встань лицом к стене на расстоянии вытянутых рук | Наклонись, руки на стене | Вытягивай спину параллельно полу | Держи 7-10 дыханий | Медленно выпрямись;back_pain,hamstring_injury;Мягко вытягивает заднюю поверхность ног и спину, учит правильному наклону, доступна для начинающих и людей с ограничениями.;forward_fold,accessible,props,gentle,alignment
117;Поза щенка с болстером;yoga;4;2;low;false;false;1;14;70;Встань на четвереньки | Помести болстер под грудь | Опустись на болстер, руки вперёд | Расслабься, дыши спокойно 5-10 минут | Медленно поднимись;shoulder_injury;Глубоко расслабляет, мягко вытягивает плечи и позвоночник, восстанавливает, успокаивает нервную систему.;restorative,props,relaxation,shoulders,gentle
118;Баласана с болстером;yoga;5;1;low;false;false;1;14;70;Встань на колени | Помести болстер между ног | Наклонись вперёд, лоб на болстер | Руки вдоль тела, расслабься | Дыши спокойно 5-10 минут | Медленно поднимись;knee_pain,pregnancy;Глубоко расслабляет, поддерживает тело, успокаивает ум, снимает напряжение со спины, подходит для длительного отдыха.;restorative,props,relaxation,gentle,accessible
119;Супта скрутка с болстером;yoga;8;1;low;false;false;1;14;70;Ляг на спину, болстер справа | Подтяни колени к груди, опусти их на болстер вправо | Руки в стороны, расслабься | Дыши 5-10 минут | Повтори на другую сторону;back_pain,pregnancy;Мягко скручивает позвоночник, глубоко расслабляет, массирует органы, успокаивает, подходит для вечера.;restorative,props,twist,relaxation,evening
120;Сетубандха восстановительная;yoga;10;1;low;false;false;1;14;70;Ляг на спину, согни ноги | Помести болстер или блоки под крестец | Руки вдоль тела, расслабься | Дыши спокойно 5-10 минут | Убери опору и опустись;back_pain,neck_pain;Восстанавливает, мягко раскрывает грудь, снимает усталость, успокаивает нервную систему, улучшает кровообращение.;restorative,props,relaxation,gentle,circulation
121;Поза ребёнка с длинным выдохом;yoga;2;1;low;false;false;1;14;70;Встань на колени, сядь на пятки | Наклонись вперёд в позу ребёнка | Дыши через нос, делая выдох в два раза длиннее вдоха | Продолжай 2-3 минуты | Медленно поднимись;knee_pain,pregnancy;Глубоко успокаивает нервную систему, снижает стресс, улучшает качество дыхания, готовит ко сну.;breath,relaxation,calmness,nervous_system,gentle
122;Кошка-Корова 10 циклов;yoga;3;1;low;false;false;1;14;70;Встань на четвереньки | На вдохе прогни спину (Корова), на выдохе округли (Кошка) | Двигайся медленно и плавно | Повтори 8-10 циклов | Вернись в нейтраль и отдохни;none;Массирует позвоночник, улучшает гибкость, координирует дыхание с движением, разогревает спину, снимает напряжение.;spine,flexibility,breath_coordination,warm_up,gentle
123;Лёгкая виньяса 5 дыханий;yoga;4;2;low;false;false;1;14;70;Создай короткую последовательность из 3-5 поз | Например: Гора → Наклон → Полуподъём → Планка → Ребёнок | Синхронизируй каждое движение с вдохом или выдохом | Двигайся плавно без рывков | Повтори 2-3 раза;none;Разогревает тело, улучшает координацию дыхания и движения, развивает плавность, подходит для начинающих.;flow,breath_coordination,gentle,warm_up,beginner
124;Bird Dog (вытяжение противоположных конечностей);yoga;5;2;low;false;false;1;14;70;Встань на четвереньки | Вытяни правую руку вперёд и левую ногу назад | Держи баланс 3-5 дыханий | Вернись в центр | Повтори на другую сторону | Сделай 6-10 повторений;none;Укрепляет корпус и спину, развивает баланс и координацию, улучшает осанку, безопасно для спины.;core,balance,back,coordination,gentle
125;Thread the Needle (скрутка плеч);yoga;8;2;low;false;false;1;14;70;Встань на четвереньки | Продень правую руку под левой, опусти правое плечо на пол | Левая рука вперёд или вверх | Держи 7-10 дыханий | Повтори на другую сторону;shoulder_injury,neck_pain;Вытягивает плечи и верхнюю часть спины, мягко скручивает позвоночник, снимает напряжение, успокаивает.;shoulders,twist,stretching,gentle,relaxation
126;Поза стола (Tabletop hold);yoga;10;2;low;false;false;1;14;70;Встань на четвереньки | Запястья под плечами, колени под бёдрами | Держи спину ровной, шею нейтральной | Активируй корпус | Держи 5-10 дыханий | Отдохни в позе ребёнка;none;Укрепляет корпус и руки, учит нейтральному положению позвоночника, развивает осознанность выравнивания, основа для многих поз.;core,alignment,foundation,awareness,beginner
127;Обратный стол (Reverse tabletop);yoga;2;3;medium;false;false;1;14;70;Сядь, согни ноги, руки за тазом | Подними таз, тело параллельно полу | Держи 3-5 дыханий | Опустись и отдохни;wrist_pain,shoulder_injury;Укрепляет руки, плечи и ноги, раскрывает грудь, улучшает осанку, развивает силу задней поверхности тела.;strength,chest_opening,back,arms,challenge
128;Поза лодки с ремнём;yoga;3;2;low;false;false;1;14;70;Сядь, накинь ремень на стопы | Отклонись назад, подними ноги | Держи ремень руками | Держи 3-5 дыханий | Опустись;back_pain,hamstring_injury;Делает позу Лодки доступнее, укрепляет корпус, помогает сохранить выравнивание, подходит для начинающих.;core,accessible,props,strength,beginner
129;Гомукхасана руки с ремнём;yoga;4;2;low;false;false;1;14;70;Встань или сядь | Правая рука вверх, согни за спиной | Левая рука снизу за спиной | Держи ремень между руками | Держи 5-7 дыханий | Повтори на другую сторону;shoulder_injury;Делает захват рук доступнее, вытягивает плечи, улучшает гибкость, помогает постепенно сблизить руки.;shoulders,accessible,props,flexibility,gentle
130;Орёл руки (Eagle arms only);yoga;5;2;low;false;false;1;14;70;Встань или сядь | Правый локоть под левым, переплети предплечья | Ладони вместе или держи ремень | Подними локти на уровень плеч | Держи 5-7 дыханий | Повтори на другую сторону;shoulder_injury;Вытягивает плечи и верхнюю часть спины, снимает напряжение между лопатками, улучшает подвижность плеч.;shoulders,stretching,upper_back,gentle,accessible
131;Плечевой мост динамический;yoga;8;2;low;false;false;1;14;70;Ляг на спину, согни ноги | На вдохе подними таз в мост | На выдохе опусти позвонок за позвонком | Повтори 8-10 раз медленно и плавно | Отдохни;back_pain,neck_pain;Укрепляет спину и ягодицы, массирует позвоночник, улучшает подвижность, разогревает тело, координирует дыхание с движением.;backbend,dynamic,spine,warm_up,breath_coordination
132;Мягкие скрутки стоя;yoga;10;1;low;false;false;1;14;70;Встань, ноги на ширине плеч | Руки на плечах или в стороны | Мягко скручивайся вправо-влево | Двигайся от центра, плечи расслаблены | Повтори 10-15 раз в каждую сторону | Дыши свободно;none;Массирует позвоночник, разогревает спину, улучшает подвижность, снимает напряжение, подходит для разминки.;twist,dynamic,warm_up,gentle,spine
133;Сидячий боковой наклон;yoga;2;1;low;false;false;1;14;70;Сядь удобно, скрестив ноги | Правая рука на пол, левая вверх | Наклонись вправо, вытягивая левый бок | Держи 5-7 дыханий | Повтори на другую сторону;none;Вытягивает бока и межрёберные мышцы, улучшает дыхание, снимает напряжение, мягко раскрывает грудь.;side_body,stretching,breath,gentle,accessible
134;Поза горы с дыханием;yoga;3;1;low;false;false;1;14;70;Встань в Тадасану | Закрой глаза | Дыши через нос, наблюдая естественный ритм | Почувствуй устойчивость и заземление | Продолжай 2-3 минуты | Открой глаза;none;Развивает осознанность дыхания и тела, успокаивает ум, улучшает осанку, учит присутствию в простоте.;breath,awareness,grounding,calmness,beginner
135;Осознанная ходьба в йога-ритме;yoga;4;1;low;false;false;1;14;70;Иди медленно | Синхронизируй шаги с дыханием: 3-4 шага на вдох, 3-4 на выдох | Держи спину прямой | Наблюдай ощущения в стопах | Продолжай 5-10 минут;none;Развивает осознанность движения, координирует дыхание с ходьбой, успокаивает ум, подходит для активной медитации.;walking,breath,awareness,calmness,mindfulness
136;Диафрагмальное дыхание;yoga;5;1;low;false;false;1;21;70;Ляг или сядь удобно | Положи руку на живот | Вдыхай носом, расширяя живот | Выдыхай носом, живот опускается | Дыши медленно и глубоко 5-10 минут | Грудь почти неподвижна;none;Успокаивает нервную систему, улучшает качество дыхания, снижает стресс, массирует внутренние органы, учит правильному дыханию.;breath,relaxation,stress_relief,nervous_system,foundational
137;Квадратное дыхание (Box breathing);yoga;8;2;low;false;false;1;21;70;Сядь удобно с прямой спиной | Вдох на 4 счёта | Задержка на 4 | Выдох на 4 | Задержка на 4 | Повтори 5-10 циклов | Дыши через нос, плечи расслаблены;none;Балансирует нервную систему, улучшает концентрацию, снижает стресс, развивает контроль дыхания, подходит перед важными событиями.;breath,focus,balance,stress_relief,concentration
138;Нади Шодхана;yoga;10;2;low;false;false;1;14;70;Сядь с прямой спиной | Правой рукой закрой правую ноздрю, вдохни левой | Закрой левую, выдохни правой | Вдохни правой, выдохни левой | Это один цикл | Повтори 6-9 циклов | Дыши мягко без усилия;high_pressure,cold;Балансирует правое и левое полушария, успокаивает ум, очищает энергетические каналы, улучшает концентрацию, готовит к медитации.;breath,balance,calmness,focus,energy
139;Нади Шодхана 9 кругов;yoga;2;2;low;false;false;1;14;70;Сядь с прямой спиной | Выполни технику Нади Шодхана | Сделай ровно 9 полных циклов | Дыши мягко и ровно | Завершай на выдохе через левую ноздрю | Посиди спокойно минуту;high_pressure,cold;Глубоко балансирует энергию, успокаивает ум, очищает каналы, улучшает ясность мышления, традиционная практика для медитации.;breath,balance,energy,calmness,traditional
140;Уджайи дыхание;yoga;3;2;low;false;false;1;21;70;Сядь или встань удобно | Слегка сузь горло | Дыши через нос с мягким шепчущим звуком | Выдох чуть длиннее вдоха | Сделай 10-20 спокойных циклов | Дыши ровно и глубоко;none;Согревает тело, улучшает концентрацию, успокаивает ум, развивает контроль дыхания, используется в виньяса-йоге.;breath,focus,warmth,calmness,concentration
141;Самавритти пранаяма;yoga;4;2;low;false;false;1;21;70;Сядь удобно с прямой спиной | Дыши через нос с равными вдохом и выдохом | Например, 4 счёта вдох, 4 счёта выдох | Сохраняй ровный ритм 5-10 минут | Без напряжения;none;Балансирует нервную систему, успокаивает ум, улучшает концентрацию, развивает ровность дыхания, подходит для медитации.;breath,balance,calmness,focus,meditation
142;Вишама-вритти (удлинённый выдох);yoga;5;2;low;false;false;1;21;70;Сядь удобно | Дыши через нос, делая выдох длиннее вдоха | Например, вдох 4 счёта, выдох 6-8 счётов | Продолжай 5-10 минут | Без напряжения в груди;none;Активирует парасимпатическую нервную систему, глубоко успокаивает, снижает тревогу, улучшает сон, готовит к расслаблению.;breath,relaxation,calmness,sleep,nervous_system
143;Бхрамари (дыхание пчелы);yoga;8;2;low;false;false;1;21;70;Сядь удобно, закрой глаза | Вдохни через нос | На выдохе издай ровный гудящий звук «ммм» | Почувствуй вибрацию в лице и груди | Сделай 5-8 циклов | Выдох длиннее вдоха;none;Успокаивает ум и нервную систему, снижает тревогу, улучшает концентрацию, помогает при бессоннице, создаёт внутреннюю тишину.;breath,calmness,vibration,sleep,anxiety_relief
144;Ситали пранаяма;yoga;10;2;low;false;false;1;21;70;Сядь удобно | Сверни язык трубочкой, высунь слегка | Вдохни через рот, ощущая прохладу | Выдохни через нос | Повтори 5-10 циклов | Закрой рот и подыши носом;high_pressure,fever;Охлаждает тело, снижает жар, успокаивает ум, уменьшает гнев, освежает в жару.;breath,cooling,calmness,anger_management,summer
145;Ситкари пранаяма;yoga;2;2;low;false;false;1;21;70;Сядь удобно | Сожми зубы, губы слегка раздвинуты | Вдохни через зубы со звуком «сссс» | Выдохни через нос | Повтори 5-10 циклов | Закрой рот;high_pressure,fever;Охлаждает тело, успокаивает ум, освежает, снижает жар, альтернатива Ситали для тех, кто не может свернуть язык.;breath,cooling,calmness,refreshing,summer
146;Капалабхати (мягкая версия);yoga;3;3;medium;false;false;1;21;60;Сядь прямо с активным корпусом | Сделай серию коротких активных выдохов носом | Живот мягко подтягивается на выдохе, вдохи пассивные | Начни с 20-30 выдохов в комфортном темпе | Отдохни, дыши спокойно;high_pressure,pregnancy,heart_disease,hernia;Очищает дыхательные пути, активирует ум, даёт энергию, массирует органы живота, готовит к медитации.;breath,energizing,cleansing,activation,advanced
147;Бхастрика (подготовительная);yoga;4;4;high;false;false;1;21;60;Сядь прямо | Сделай 10-15 энергичных одинаковых вдохов и выдохов через нос | Затем пауза и спокойное дыхание | Повтори 2-3 раунда | Только если нет головокружения;high_pressure,pregnancy,heart_disease,epilepsy;Активирует тело и ум, даёт мощный заряд энергии, очищает каналы, разогревает, требует осторожности.;breath,energizing,activation,heat,advanced
148;Дыхание 4-6;yoga;5;2;low;false;false;1;21;70;Сядь или ляг удобно | Вдох через нос на 4 счёта | Выдох через нос на 6 счётов | Сохраняй ровный ритм 2-5 минут | Наблюдай, как тело постепенно успокаивается;none;Активирует парасимпатическую систему, глубоко успокаивает, снижает стресс и тревогу, улучшает вариабельность сердечного ритма.;breath,relaxation,calmness,stress_relief,heart
149;Дыхание 4-7-8;yoga;8;3;medium;false;false;1;21;70;Вдохни через нос на 4 счёта | Задержи дыхание на 7 счётов | Медленно выдохни через рот или нос на 8 счётов | Начни с 3-4 циклов | Без перенапряжения;high_pressure,pregnancy;Глубоко расслабляет, помогает заснуть, снижает тревогу, успокаивает нервную систему, техника доктора Вейла.;breath,sleep,relaxation,anxiety_relief,evening
150;Трёхчастное дыхание (Dirga);yoga;10;2;low;false;false;1;21;70;Ляг или сядь удобно | Вдыхай последовательно: живот, рёбра, грудь | Выдыхай в обратном порядке: грудь, рёбра, живот | Дыши медленно и полно | Продолжай 5-10 минут;none;Учит полному йоговскому дыханию, улучшает ёмкость лёгких, успокаивает, развивает осознанность дыхания, основа для пранаямы.;breath,foundational,awareness,calmness,full_breath
151;Подсчёт дыханий 1–10;yoga;2;1;low;false;false;1;21;70;Сядь удобно с прямой спиной | Считай дыхания от 1 до 10 | Один цикл вдох-выдох = 1 | Если отвлёкся, мягко начни снова с 1 | Без оценки себя | Продолжай 5-10 минут;none;Развивает концентрацию, успокаивает ум, учит возвращать внимание без самокритики, простая техника для начинающих.;breath,focus,calmness,beginner,concentration
152;Резонансное дыхание (~6 в/мин);yoga;3;2;low;false;false;1;21;70;Сядь или ляг удобно | Дыши через нос в ритме около 5-6 дыханий в минуту | Примерно вдох 5 секунд, выдох 5-6 секунд | Продолжай ровно, не форсируя глубину | 5-20 минут;none;Оптимизирует вариабельность сердечного ритма, балансирует нервную систему, снижает стресс, улучшает здоровье сердца.;breath,balance,heart,stress_relief,healing
153;Пранаяма перед сном;yoga;4;2;low;false;false;1;21;70;Ляг в постели | Дыши через нос, удлиняя выдох | Расслабь тело с каждым выдохом | Отпускай мысли о дне | Продолжай до засыпания;none;Готовит ко сну, успокаивает нервную систему, снижает тревогу, помогает отпустить дневные заботы, улучшает качество сна.;breath,sleep,relaxation,evening,bedtime
154;Дыхание через нос в ходьбе;yoga;5;1;low;false;false;1;21;70;Иди в обычном темпе | Дыши только через нос | Синхронизируй дыхание с шагами | Если задыхаешься, замедли темп | Продолжай 10-20 минут;none;Улучшает носовое дыхание, тренирует дыхательную систему, успокаивает ум, развивает выносливость, полезно для здоровья.;breath,walking,endurance,health,mindfulness
