id;name;category;duration_min;difficulty;physical_intensity;requires_morning;requires_silence;max_completions_per_day;habit_min_streak_days;habit_min_score;steps;contraindications;benefits;tags
74;Стойка на руках prep у стены;yoga;3;5;high;false;false;1;14;60;Встань лицом к стене в Собаке мордой вниз | Подними одну ногу к стене | Оттолкнись второй ногой | Держи 3-5 дыханий у стены | Опустись;wrist_pain,shoulder_injury,high_pressure,vertigo;Готовит к стойке на руках, укрепляет руки и плечи, развивает баланс и силу, учит преодолевать страх.;inversion,arms,strength,balance,challenge
75;Дандасана (Посох);yoga;4;2;low;false;false;1;14;70;Сядь, ноги вытянуты вперёд | Руки по бокам от таза, пальцы вперёд | Выпрями спину, макушка вверх | Активируй ноги | Держи 5-7 дыханий;back_pain,hamstring_injury;Укрепляет спину и корпус, улучшает осанку, учит правильному выравниванию в сидячих позах, развивает осознанность.;alignment,posture,core,foundation,awareness
76;Сукхасана;yoga;5;1;low;false;false;1;14;70;Сядь, скрести ноги удобно | Выпрями спину, руки на коленях | Расслабь плечи | Дыши спокойно 7-10 циклов | Поменяй перекрест ног;knee_pain,hip_pain;Успокаивает ум, подходит для медитации, раскрывает бёдра, улучшает осанку, учит сидеть с прямой спиной.;meditation,sitting,calmness,hips,beginner
77;Ваджрасана;yoga;8;1;low;false;false;1;14;70;Встань на колени | Сядь ягодицами на пятки | Руки на бёдрах | Спина прямая | Дыши спокойно 7-10 циклов;knee_pain,ankle_injury;Улучшает пищеварение, успокаивает ум, укрепляет лодыжки, подходит для медитации и дыхательных практик.;meditation,sitting,digestion,calmness,simple
78;Вирасана (Герой);yoga;10;2;low;false;false;1;14;70;Встань на колени, стопы шире таза | Сядь между пятками на пол или на опору | Спина прямая, руки на бёдрах | Держи 5-7 дыханий | Медленно выйди;knee_pain,ankle_injury;Вытягивает бёдра и лодыжки, улучшает пищеварение, успокаивает ум, подходит для медитации и пранаямы.;meditation,sitting,thighs,ankles,calmness
79;Сиддхасана;yoga;2;2;medium;false;false;1;14;70;Сядь, одну пятку к промежности, вторую перед ней | Спина прямая, руки на коленях | Дыши спокойно 7-10 циклов | Поменяй ноги;knee_pain,hip_pain,ankle_injury;Классическая поза для медитации, успокаивает ум, раскрывает бёдра, улучшает концентрацию, балансирует энергию.;meditation,sitting,focus,hips,energy
80;Падмасана (Лотос);yoga;3;4;low;false;false;1;14;70;Сядь, помести правую стопу на левое бедро | Левую стопу на правое бедро | Спина прямая, руки на коленях | Дыши спокойно 5-7 циклов | Осторожно выйди;knee_pain,hip_pain,ankle_injury;Классическая поза для медитации, глубоко раскрывает бёдра, успокаивает ум, улучшает концентрацию, балансирует энергию.;meditation,sitting,hips,focus,traditional
81;Ардха Падмасана;yoga;4;3;low;false;false;1;14;70;Сядь, помести одну стопу на противоположное бедро | Вторую ногу согни перед собой | Спина прямая, руки на коленях | Дыши спокойно 7-10 циклов | Поменяй ноги;knee_pain,hip_pain,ankle_injury;Подготовка к Лотосу, раскрывает бёдра, успокаивает ум, подходит для медитации, более доступна чем полный Лотос.;meditation,sitting,hips,preparation,calmness
82;Навасана (Лодка);yoga;5;4;medium;false;false;1;14;70;Сядь, ноги вытянуты | Отклонись назад, подними ноги | Руки вперёд параллельно полу | Тело в форме буквы V | Держи 3-5 дыханий | Опустись и отдохни;back_pain,neck_pain,pregnancy;Укрепляет корпус и сгибатели бедра, улучшает баланс, развивает силу воли, стимулирует пищеварение.;core,strength,balance,willpower,abs
83;Ардха Навасана (Полулодка);yoga;8;5;high;false;false;1;14;60;Сядь, ноги вытянуты | Отклонись назад ниже, чем в Навасане | Подними ноги ниже | Руки вперёд или за головой | Держи 2-5 дыханий | Опустись;back_pain,neck_pain,pregnancy;Интенсивно укрепляет корпус, развивает силу и выносливость, улучшает контроль тела, тренирует силу воли.;core,strength,challenge,abs,endurance
84;Баддха Конасана (Бабочка);yoga;10;2;low;false;false;1;14;70;Сядь, соедини стопы, колени в стороны | Подтяни стопы к тазу | На вдохе вытяни спину | На выдохе мягко наклонись вперёд | Держи 7-10 дыханий | Медленно поднимись;knee_pain,hip_pain,groin_injury;Раскрывает бёдра и пах, улучшает гибкость, стимулирует органы таза, успокаивает ум, готовит к родам.;hip_opening,groin,flexibility,calmness,women
85;Упавиштха Конасана;yoga;2;3;medium;false;false;1;14;70;Сядь, ноги широко в стороны | На вдохе вытяни спину | На выдохе наклонись вперёд между ног | Руки вперёд на пол | Держи 7-10 дыханий | Медленно поднимись;back_pain,hamstring_injury,groin_injury;Вытягивает внутреннюю поверхность ног, раскрывает бёдра, успокаивает ум, улучшает гибкость, стимулирует органы таза.;hip_opening,legs,flexibility,calmness,stretching
86;Джану Ширшасана;yoga;3;2;low;false;false;1;14;70;Сядь, одну ногу вытяни, вторую согни, стопа к внутренней поверхности бедра | На вдохе вытяни спину | На выдохе наклонись к прямой ноге | Держи 7-10 дыханий | Повтори на другую сторону;back_pain,knee_pain,hamstring_injury;Вытягивает заднюю поверхность ноги, успокаивает ум, улучшает пищеварение, массирует органы живота.;forward_fold,hamstrings,calmness,digestion,stretching
87;Пашчимоттанасана;yoga;4;3;medium;false;false;1;14;70;Сядь, ноги вытянуты вперёд | На вдохе вытяни спину | На выдохе наклонись вперёд к ногам | Руки к стопам или голеням | Держи 7-10 дыханий | Медленно поднимись;back_pain,hamstring_injury,pregnancy;Глубоко вытягивает заднюю поверхность тела, успокаивает ум, улучшает пищеварение, снимает стресс.;forward_fold,hamstrings,calmness,stretching,stress_relief
88;Ардха Матсиендрасана;yoga;5;3;medium;false;false;1;14;70;Сядь, правую ногу согни, стопа у левого бедра | Левую ногу перенеси через правую | На вдохе вытяни спину | На выдохе скрутись влево | Держи 5-7 дыханий | Повтори на другую сторону;back_pain,knee_pain,pregnancy;Скручивает позвоночник, улучшает пищеварение, массирует внутренние органы, раскрывает грудь, развивает гибкость.;twist,spine,detox,digestion,flexibility
89;Маричиасана C;yoga;8;4;medium;false;false;1;14;70;Сядь, правую ногу вытяни, левую согни, стопа на полу | На вдохе вытяни спину | На выдохе скрутись влево, правый локоть за левое колено | Держи 5-7 дыханий | Повтори на другую сторону;back_pain,knee_pain;Глубоко скручивает позвоночник, улучшает пищеварение, массирует органы, развивает гибкость и концентрацию.;twist,spine,detox,digestion,challenge
90;Гомукхасана;yoga;10;3;medium;false;false;1;14;70;Сядь, правое колено над левым, стопы у противоположных бёдер | Правая рука вверх, согни за спиной | Левая рука снизу за спиной | Попытайся соединить руки | Держи 5-7 дыханий | Повтори на другую сторону;knee_pain,shoulder_injury,hip_pain;Раскрывает бёдра и плечи, вытягивает руки, улучшает осанку, развивает гибкость в труднодоступных зонах.;hips,shoulders,flexibility,stretching,challenge
91;Эка Пада Раджакапотасана prep (Голубь);yoga;2;3;medium;false;false;1;14;70;Из Собаки мордой вниз вынеси правую ногу вперёд, согни, голень параллельно краю коврика | Левую ногу вытяни назад | Опустись на предплечья или лоб к полу | Держи 7-10 дыханий | Повтори на другую сторону;knee_pain,hip_pain,ankle_injury;Глубоко раскрывает бёдра, вытягивает сгибатели бедра, снимает эмоциональное напряжение, успокаивает ум.;hip_opening,deep_stretch,emotional_release,calmness,flexibility
92;Figure-4 лёжа (Супта Капотасана);yoga;3;2;low;false;false;1;14;70;Ляг на спину, согни ноги | Помести правую лодыжку на левое бедро | Продень руки между ног, обхвати левое бедро | Притяни к груди | Держи 7-10 дыханий | Повтори на другую сторону;knee_pain,hip_pain;Мягко раскрывает бёдра, снимает напряжение с поясницы, успокаивает, доступна для начинающих.;hip_opening,gentle,lower_back,calmness,accessible
93;Супта Баддха Конасана;yoga;4;1;low;false;false;1;14;70;Ляг на спину | Соедини стопы, колени в стороны | Руки вдоль тела или на живот | Подложи опоры под колени при необходимости | Дыши спокойно 7-10 минут | Медленно выйди;knee_pain,hip_pain,groin_injury;Глубоко расслабляет, раскрывает бёдра и грудь, успокаивает нервную систему, восстанавливает, подходит для вечера.;restorative,hip_opening,relaxation,calmness,evening
94;Апанасана;yoga;5;1;low;false;false;1;14;70;Ляг на спину | Подтяни колени к груди | Обхвати колени руками | Мягко покачивайся из стороны в сторону | Дыши спокойно 7-10 циклов | Опусти ноги;none;Массирует поясницу, улучшает пищеварение, снимает напряжение, успокаивает, помогает при вздутии живота.;lower_back,digestion,gentle,massage,calmness
95;Супта Матсиендрасана;yoga;8;2;low;false;false;1;14;70;Ляг на спину, руки в стороны | Подтяни правое колено к груди | Опусти колено влево, скрутись | Правое плечо на полу | Держи 7-10 дыханий | Повтори на другую сторону;back_pain,knee_pain,pregnancy;Мягко скручивает позвоночник, массирует органы, снимает напряжение со спины, успокаивает, готовит ко сну.;twist,spine,relaxation,detox,evening
96;Ананда Баласана (Happy Baby);yoga;10;1;low;false;false;1;14;70;Ляг на спину, подтяни колени к груди | Возьмись за внешние края стоп | Колени шире корпуса, голени перпендикулярно полу | Мягко покачивайся | Держи 7-10 дыханий | Опусти ноги;knee_pain,hip_pain,groin_injury;Раскрывает бёдра и пах, массирует поясницу, снимает стресс, расслабляет, улучшает настроение.;hip_opening,lower_back,relaxation,playful,stress_relief
97;Паванамуктасана;yoga;2;1;low;false;false;1;14;70;Ляг на спину | Подтяни правое колено к груди, обхвати руками | Держи 5-7 дыханий | Опусти и повтори с левой ногой | Затем обе ноги вместе | Дыши спокойно;none;Улучшает пищеварение, снимает газы и вздутие, массирует органы живота, расслабляет поясницу.;digestion,gentle,lower_back,massage,simple
98;Сету Бандха Сарвангасана (Полумост);yoga;3;3;medium;false;false;1;14;70;Ляг на спину, согни ноги, стопы на полу | Подними таз вверх | Переплети пальцы под спиной или руки вдоль тела | Держи 5-7 дыханий | Медленно опустись позвонок за позвонком;neck_pain,back_pain,high_pressure;Раскрывает грудь и плечи, укрепляет спину и ягодицы, улучшает настроение, стимулирует щитовидную железу.;backbend,chest_opening,strength,mood,energizing
99;Поддержанный мост на блоке;yoga;4;1;low;false;false;1;14;70;Ляг на спину, согни ноги | Подними таз и помести блок под крестец | Руки вдоль тела, расслабься | Дыши спокойно 5-10 минут | Убери блок и опустись;back_pain,neck_pain;Восстанавливает, мягко раскрывает грудь, снимает усталость с ног, успокаивает нервную систему, подходит для вечера.;restorative,gentle,relaxation,legs,evening
100;Урдхва Дханурасана (Колесо);yoga;5;5;high;false;false;1;14;60;Ляг на спину, согни ноги, стопы у ягодиц | Руки у ушей, пальцы к плечам | На вдохе подними таз и грудь, выпрями руки | Держи 3-5 дыханий | Опустись медленно;back_pain,wrist_pain,shoulder_injury,neck_pain,high_pressure;Глубоко раскрывает грудь и плечи, укрепляет всё тело, даёт мощный заряд энергии, развивает силу и гибкость.;backbend,full_body,energy,strength,challenge
101;Шалабхасана (Саранча);yoga;8;3;medium;false;false;1;14;70;Ляг на живот, руки вдоль тела | На вдохе подними грудь, руки и ноги от пола | Тянись назад и вверх | Держи 3-5 дыханий | Опустись и расслабься;back_pain,neck_pain,pregnancy;Укрепляет всю заднюю поверхность тела, улучшает осанку, стимулирует органы живота, развивает выносливость.;backbend,strength,full_body,posture,endurance
102;Дханурасана (Лук);yoga;10;4;high;false;false;1;14;70;Ляг на живот | Согни ноги, возьмись руками за лодыжки | На вдохе подними грудь и бёдра, прогнись | Держи 3-5 дыханий | Опустись и расслабься;back_pain,neck_pain,shoulder_injury,pregnancy;Глубоко раскрывает грудь и плечи, укрепляет спину, массирует органы живота, улучшает гибкость позвоночника.;backbend,chest_opening,strength,flexibility,challenge
103;Уштрасана (Верблюд);yoga;2;4;medium;false;false;1;14;70;Встань на колени, бёдра перпендикулярно полу | Руки на поясницу | Прогнись назад, руки к пяткам | Держи 3-5 дыханий | Медленно выйди, опустив подбородок к груди;back_pain,neck_pain,high_pressure,vertigo;Глубоко раскрывает грудь и горло, вытягивает переднюю поверхность тела, улучшает осанку, стимулирует щитовидную железу.;backbend,chest_opening,throat,energy,challenge
104;Матсиасана (Рыба);yoga;3;3;medium;false;false;1;14;70;Ляг на спину, ноги вытянуты | Подложи руки под ягодицы | Прогнись, макушка на полу | Держи 3-5 дыханий | Опусти голову и расслабься;neck_pain,back_pain,high_pressure;Раскрывает грудь и горло, компенсирует наклоны вперёд, улучшает дыхание, стимулирует щитовидную железу.;backbend,chest_opening,throat,breath,compensation
105;Пурвоттанасана (Обратная планка);yoga;4;4;medium;false;false;1;14;70;Сядь, ноги вытянуты, руки за тазом | Подними таз вверх, тело — прямая линия | Голова назад или нейтрально | Держи 3-5 дыханий | Опустись;wrist_pain,shoulder_injury,neck_pain;Укрепляет руки, плечи, спину и ноги, раскрывает грудь, улучшает осанку, развивает силу всего тела.;strength,backbend,full_body,chest_opening,challenge
106;Шавасана;yoga;5;1;low;false;true;1;14;70;Ляг на спину, ноги чуть шире плеч, руки вдоль тела ладонями вверх | Закрой глаза | Полностью расслабь всё тело | Наблюдай дыхание | Оставайся неподвижно 5-15 минут | Медленно вернись;none;Глубоко расслабляет тело и ум, интегрирует практику, восстанавливает нервную систему, снижает стресс и тревогу.;relaxation,integration,rest,stress_relief,essential
107;Випарита Карани (Ноги на стене);yoga;8;1;low;false;false;1;14;70;Ляг боком к стене | Разверни таз, подними ноги на стену | Руки вдоль тела, расслабься | Дыши спокойно 5-10 минут | Согни ноги и повернись на бок;varicose_veins,glaucoma,high_pressure;Снимает усталость с ног, улучшает кровообращение, успокаивает нервную систему, помогает при бессоннице.;restorative,legs,relaxation,circulation,evening
108;Йога-нидра (базовая);yoga;10;2;low;false;true;1;14;70;Ляг в Шавасану | Закрой глаза | Следуй голосовым инструкциям или сканируй тело от стоп к макушке | Наблюдай ощущения без оценки | Оставайся на грани сна и бодрствования 10-30 минут | Медленно вернись;none;Глубоко расслабляет на всех уровнях, восстанавливает нервную систему, улучшает сон, снижает тревогу и стресс.;deep_relaxation,restorative,sleep,stress_relief,meditation
109;Сурья Намаскар A;yoga;2;2;medium;true;false;3;14;70;Встань в Тадасану | Вдох — руки вверх | Выдох — наклон | Вдох — полуподъём | Выдох — Чатуранга | Вдох — Собака вверх | Выдох — Собака вниз | Вдох — шаг вперёд, полуподъём | Выдох — наклон | Вдох — руки вверх | Выдох — Тадасана | Повтори 3-6 кругов;back_pain,wrist_pain,shoulder_injury;Разогревает всё тело, улучшает гибкость и силу, координирует дыхание с движением, даёт энергию на весь день.;flow,full_body,energizing,breath_coordination,morning
110;Сурья Намаскар B;yoga;3;3;medium;true;false;3;14;70;Тадасана | Уткатасана | Наклон | Полуподъём | Чатуранга | Собака вверх | Собака вниз | Воин I правая | Чатуранга | Собака вверх | Собака вниз | Воин I левая | Чатуранга | Собака вверх | Собака вниз | Полуподъём | Наклон | Уткатасана | Тадасана | Повтори 3-6 кругов;back_pain,wrist_pain,knee_pain,shoulder_injury;Более интенсивно разогревает тело, укрепляет ноги и корпус, развивает выносливость, улучшает координацию и концентрацию.;flow,full_body,strength,energizing,morning
111;Чандра Намаскар;yoga;4;2;low;false;false;1;14;70;Встань в Тадасану | Выполни мягкую последовательность с боковыми наклонами и скрутками | Двигайся медленнее чем в Сурья Намаскар | Синхронизируй движения с дыханием | Сделай 3-6 кругов | Завершай в спокойном ритме;none;Успокаивает нервную систему, подходит для вечера, развивает гибкость боков, балансирует энергию, готовит ко сну.;flow,calming,evening,flexibility,gentle
112;Триконасана с блоком;yoga;5;2;low;false;false;1;14;70;Встань в Триконасану | Помести блок под нижней рукой для поддержки | Раскрой грудь, взгляд вверх | Держи 5-7 дыханий | Повтори на другую сторону;back_pain,neck_pain;Делает Триконасану доступнее, помогает сохранить выравнивание, вытягивает бока, развивает баланс без перенапряжения.;triangle,accessible,props,balance,alignment
113;Врикшасана у стены;yoga;8;2;low;false;false;1;14;70;Встань спиной к стене | Выполни позу Дерева, опираясь спиной на стену | Держи 5-7 дыханий | Повтори на другую сторону;ankle_injury;Делает балансовую позу доступнее, помогает почувствовать выравнивание, развивает уверенность, подходит для начинающих.;balance,accessible,props,beginner,confidence
